{
 "$schema": "./world.schema.json",
 "schemaVersion": "1.1.0",
 "project": "kantor-rpg",
 "revision": {
  "id": "P03",
  "date": "2026-10-01",
  "note": "Hardening: arah bukaan pintu dan jendela konsep di dataset; gym provisional (Q-03)"
 },
 "status": "KONSEP - bukan untuk konstruksi. Semua ukuran proposal untuk review.",
 "units": {
  "length": "m",
  "cadExportUnit": "mm",
  "cadScale": 1000,
  "angle": "deg"
 },
 "coordinates": {
  "origin": "sudut barat daya lantai jadi L1",
  "axes": {
   "x": "timur",
   "y": "utara",
   "z": "atas"
  },
  "runtimeThree": "three = [x, z, -y] (Y-up); rotasi world rot -> three rotation.y = rad(rot)",
  "blender": "identik dengan world (Z-up); exporter glTF mengubah ke Y-up: gltf = [x, z, -y]",
  "cad": "DXF WCS = world * 1000 (mm), Z = elevasi lantai",
  "fixtureFront": "lokal -Y pada rot 0; rot CCW derajat"
 },
 "building": {
  "id": "KRPG-01",
  "name": "kantor-rpg",
  "footprint": [
   32,
   24
  ],
  "floorToFloor": 4.0,
  "ceilingHeight": 3.0,
  "slab": 0.3,
  "wall": {
   "exterior": 0.3,
   "interior": 0.15
  },
  "assumptions": [
   "AS-DIM-01",
   "AS-DIM-03"
  ]
 },
 "floors": [
  {
   "id": "L1",
   "name": "Lantai 1 - Kerja & Kunjungan",
   "level": 1,
   "elevation": 0.0,
   "envelope": [
    [
     0,
     0
    ],
    [
     32,
     0
    ],
    [
     32,
     24
    ],
    [
     0,
     24
    ]
   ],
   "spawn": "WP-L1-SPAWN",
   "safePoint": "WP-L1-SAFE"
  },
  {
   "id": "L2",
   "name": "Lantai 2 - Rekreasi",
   "level": 2,
   "elevation": 4.0,
   "envelope": [
    [
     0,
     0
    ],
    [
     32,
     0
    ],
    [
     32,
     24
    ],
    [
     0,
     24
    ]
   ],
   "spawn": "WP-L2-SAFE",
   "safePoint": "WP-L2-SAFE"
  }
 ],
 "rooms": [
  {
   "id": "L1-MEET",
   "floor": "L1",
   "name": "Ruang rapat besar",
   "category": "work",
   "access": "public",
   "noise": "moderate",
   "function": "Rapat tim dan tamu, presentasi",
   "polygon": [
    [
     0,
     0
    ],
    [
     8,
     0
    ],
    [
     8,
     8
    ],
    [
     0,
     8
    ]
   ],
   "occupantLoadKey": "assembly_tables",
   "finish": {
    "floor": "karpet tile matte",
    "wall": "cat matte krem",
    "ceiling": "akustik panel"
   },
   "ict": [
    "layar dinding",
    "outlet meja rapat",
    "AP coverage"
   ],
   "status": "proposal konsep",
   "assumptions": [
    "AS-DIM-01",
    "AS-DIM-02"
   ]
  },
  {
   "id": "L1-LOBBY",
   "floor": "L1",
   "name": "Lobby & resepsi",
   "category": "public",
   "access": "public",
   "noise": "moderate",
   "function": "Kedatangan, resepsi, titik spawn CEO",
   "polygon": [
    [
     8,
     0
    ],
    [
     20,
     0
    ],
    [
     20,
     8
    ],
    [
     8,
     8
    ]
   ],
   "occupantLoadKey": "business",
   "finish": {
    "floor": "vinyl motif kayu",
    "wall": "cat matte krem + panel kayu",
    "ceiling": "gypsum"
   },
   "ict": [
    "outlet resepsi",
    "papan direktori",
    "AP",
    "kamera konsep pintu masuk"
   ],
   "status": "proposal konsep",
   "assumptions": [
    "AS-DIM-01",
    "AS-DIM-02"
   ]
  },
  {
   "id": "L1-GALLERY",
   "floor": "L1",
   "name": "Galeri portofolio",
   "category": "public",
   "access": "public",
   "noise": "quiet",
   "function": "Pameran karya tim (artwork original)",
   "polygon": [
    [
     20,
     0
    ],
    [
     26,
     0
    ],
    [
     26,
     8
    ],
    [
     20,
     8
    ]
   ],
   "occupantLoadKey": "business",
   "finish": {
    "floor": "vinyl motif kayu",
    "wall": "cat matte krem + panel kayu",
    "ceiling": "gypsum"
   },
   "ict": [
    "outlet display galeri"
   ],
   "status": "proposal konsep",
   "assumptions": [
    "AS-DIM-01",
    "AS-DIM-02"
   ]
  },
  {
   "id": "L1-PANTRY",
   "floor": "L1",
   "name": "Pantry kerja",
   "category": "wet",
   "access": "staff",
   "noise": "moderate",
   "function": "Kopi/air untuk area kerja",
   "polygon": [
    [
     26,
     0
    ],
    [
     29.5,
     0
    ],
    [
     29.5,
     8
    ],
    [
     26,
     8
    ]
   ],
   "occupantLoadKey": "business",
   "finish": {
    "floor": "keramik anti-slip",
    "wall": "keramik dinding",
    "ceiling": "gypsum tahan lembab"
   },
   "ict": [],
   "status": "proposal konsep",
   "assumptions": [
    "AS-DIM-01",
    "AS-DIM-02"
   ]
  },
  {
   "id": "L1-SHAFT-W",
   "floor": "L1",
   "name": "Shaft basah",
   "category": "shaft",
   "access": "restricted",
   "noise": "quiet",
   "function": "Shaft plumbing (konsep, belum desain MEP)",
   "polygon": [
    [
     29.5,
     0
    ],
    [
     32,
     0
    ],
    [
     32,
     1
    ],
    [
     29.5,
     1
    ]
   ],
   "occupantLoadKey": null,
   "finish": {
    "floor": "-",
    "wall": "-",
    "ceiling": "-"
   },
   "ict": [],
   "status": "proposal konsep",
   "assumptions": [
    "AS-DIM-01",
    "AS-DIM-02"
   ]
  },
  {
   "id": "L1-WC",
   "floor": "L1",
   "name": "Toilet aksesibel",
   "category": "wet",
   "access": "public",
   "noise": "quiet",
   "function": "Toilet + wastafel; aksesibilitas perlu kajian",
   "polygon": [
    [
     29.5,
     1
    ],
    [
     32,
     1
    ],
    [
     32,
     8
    ],
    [
     29.5,
     8
    ]
   ],
   "occupantLoadKey": null,
   "finish": {
    "floor": "keramik anti-slip",
    "wall": "keramik dinding",
    "ceiling": "gypsum tahan lembab"
   },
   "ict": [
    "tidak ada kamera (privasi)"
   ],
   "status": "proposal konsep",
   "assumptions": [
    "AS-DIM-01",
    "AS-DIM-02"
   ]
  },
  {
   "id": "L1-CORR",
   "floor": "L1",
   "name": "Koridor utama L1",
   "category": "circulation",
   "access": "public",
   "noise": "moderate",
   "function": "Sirkulasi timur-barat, dua pintu keluar konsep",
   "polygon": [
    [
     0,
     8
    ],
    [
     32,
     8
    ],
    [
     32,
     10.5
    ],
    [
     0,
     10.5
    ]
   ],
   "occupantLoadKey": null,
   "finish": {
    "floor": "vinyl motif kayu",
    "wall": "cat matte krem + panel kayu",
    "ceiling": "gypsum"
   },
   "ict": [
    "AP",
    "kamera konsep koridor"
   ],
   "status": "proposal konsep",
   "assumptions": [
    "AS-DIM-01",
    "AS-DIM-02"
   ]
  },
  {
   "id": "L1-DISC",
   "floor": "L1",
   "name": "Ruang diskusi",
   "category": "quiet",
   "access": "staff",
   "noise": "quiet",
   "function": "Diskusi kecil 4 orang",
   "polygon": [
    [
     0,
     10.5
    ],
    [
     6,
     10.5
    ],
    [
     6,
     16.5
    ],
    [
     0,
     16.5
    ]
   ],
   "occupantLoadKey": "assembly_tables",
   "finish": {
    "floor": "karpet tile matte",
    "wall": "cat matte krem",
    "ceiling": "akustik panel"
   },
   "ict": [],
   "status": "proposal konsep",
   "assumptions": [
    "AS-DIM-01",
    "AS-DIM-02"
   ]
  },
  {
   "id": "L1-IMPL",
   "floor": "L1",
   "name": "Ruang implementasi & review",
   "category": "work",
   "access": "staff",
   "noise": "moderate",
   "function": "Workstation implementasi/review (Rex, Max)",
   "polygon": [
    [
     6,
     10.5
    ],
    [
     14,
     10.5
    ],
    [
     14,
     16.5
    ],
    [
     6,
     16.5
    ]
   ],
   "occupantLoadKey": "business",
   "finish": {
    "floor": "karpet tile matte",
    "wall": "cat matte krem",
    "ceiling": "akustik panel"
   },
   "ict": [
    "2 port per workstation",
    "layar review",
    "AP"
   ],
   "status": "proposal konsep",
   "assumptions": [
    "AS-DIM-01",
    "AS-DIM-02"
   ]
  },
  {
   "id": "L1-CORE",
   "floor": "L1",
   "name": "Inti tangga & lift L1",
   "category": "circulation",
   "access": "public",
   "noise": "moderate",
   "function": "Tangga U dan lift konsep ke L2",
   "polygon": [
    [
     14,
     10.5
    ],
    [
     20,
     10.5
    ],
    [
     20,
     16.5
    ],
    [
     14,
     16.5
    ]
   ],
   "occupantLoadKey": null,
   "finish": {
    "floor": "vinyl motif kayu",
    "wall": "cat matte krem + panel kayu",
    "ceiling": "gypsum"
   },
   "ict": [],
   "status": "proposal konsep",
   "assumptions": [
    "AS-DIM-01",
    "AS-DIM-02"
   ]
  },
  {
   "id": "L1-NOVA",
   "floor": "L1",
   "name": "Area Nova (spesifikasi ICT)",
   "category": "work",
   "access": "staff",
   "noise": "quiet",
   "function": "Spesifikasi ICT, meja denah",
   "polygon": [
    [
     20,
     10.5
    ],
    [
     26,
     10.5
    ],
    [
     26,
     16.5
    ],
    [
     20,
     16.5
    ]
   ],
   "occupantLoadKey": "business",
   "finish": {
    "floor": "karpet tile matte",
    "wall": "cat matte krem",
    "ceiling": "akustik panel"
   },
   "ict": [
    "2 port per workstation"
   ],
   "status": "proposal konsep",
   "assumptions": [
    "AS-DIM-01",
    "AS-DIM-02"
   ]
  },
  {
   "id": "L1-LAB",
   "floor": "L1",
   "name": "Lab ICT",
   "category": "work",
   "access": "staff",
   "noise": "moderate",
   "function": "Bench uji perangkat virtual, terpisah dari server",
   "polygon": [
    [
     26,
     10.5
    ],
    [
     32,
     10.5
    ],
    [
     32,
     16.5
    ],
    [
     26,
     16.5
    ]
   ],
   "occupantLoadKey": "business",
   "finish": {
    "floor": "vinyl anti-statik (target)",
    "wall": "cat matte",
    "ceiling": "gypsum + akses tray"
   },
   "ict": [
    "4 port per bench",
    "rack lab terbuka (bukan produksi)"
   ],
   "status": "proposal konsep",
   "assumptions": [
    "AS-DIM-01",
    "AS-DIM-02"
   ]
  },
  {
   "id": "L1-NCORR",
   "floor": "L1",
   "name": "Koridor utara L1",
   "category": "circulation",
   "access": "staff",
   "noise": "moderate",
   "function": "Akses sayap kerja tenang",
   "polygon": [
    [
     0,
     16.5
    ],
    [
     32,
     16.5
    ],
    [
     32,
     18.5
    ],
    [
     0,
     18.5
    ]
   ],
   "occupantLoadKey": null,
   "finish": {
    "floor": "vinyl motif kayu",
    "wall": "cat matte krem + panel kayu",
    "ceiling": "gypsum"
   },
   "ict": [
    "AP",
    "kamera konsep pintu server"
   ],
   "status": "proposal konsep",
   "assumptions": [
    "AS-DIM-01",